{
  "name": "marketplace-starter",
  "version": "0.1.0",
  "description": "Starter skill showing the expected Slop Market plugin layout.",
  "author": {
    "name": "Jason Rigby",
    "email": "jason@jasonrig.by",
    "url": "https://github.com/jasonrig"
  },
  "homepage": "https://github.com/jasonrig/slop-market",
  "repository": "https://github.com/jasonrig/slop-market/tree/main/plugins/marketplace-starter",
  "license": "MIT",
  "keywords": [
    "marketplace",
    "starter",
    "codex",
    "claude-code"
  ],
  "skills": "./skills/",
  "interface": {
    "displayName": "Marketplace Starter",
    "shortDescription": "Verify Slop Market plugin wiring.",
    "longDescription": "A minimal cross-compatible plugin used as a template for new marketplace entries.",
    "developerName": "Jason Rigby",
    "category": "Productivity",
    "capabilities": [
      "Read"
    ],
    "websiteURL": "https://github.com/jasonrig/slop-market",
    "defaultPrompt": [
      "Use Marketplace Starter to check whether this marketplace is installed."
    ],
    "brandColor": "#10A37F"
  }
}
