{
  "$schema": "../../../schemas/codex-plugin.schema.json",
  "name": "language-experts",
  "version": "0.1.0",
  "description": "Language-specific expert skills for authoring, reviewing, and refactoring code.",
  "author": {
    "name": "Jason Rigby",
    "email": "jason@jasonrig.by",
    "url": "https://github.com/jasonrig"
  },
  "homepage": "https://github.com/jasonrig/slop-market",
  "repository": "https://github.com/jasonrig/slop-market/tree/main/plugins/language-experts",
  "license": "MIT",
  "keywords": [
    "language-experts",
    "kotlin",
    "developer-tools",
    "codex",
    "claude-code"
  ],
  "skills": "./skills/",
  "interface": {
    "displayName": "Language Experts",
    "shortDescription": "Use language-specific experts for code work.",
    "longDescription": "Language-specific expert skills for authoring, reviewing, and refactoring code.",
    "developerName": "Jason Rigby",
    "category": "Developer Tools",
    "capabilities": [
      "Read",
      "Edit"
    ],
    "websiteURL": "https://github.com/jasonrig/slop-market",
    "defaultPrompt": [
      "Use Kotlin Expert when writing, reviewing, or refactoring Kotlin code."
    ],
    "brandColor": "#10A37F"
  }
}
