{
  "name": "marketplace-starter",
  "description": "Starter skill showing the expected Slop Market plugin layout.",
  "version": "0.1.0",
  "author": {
    "name": "Jason Rigby"
  },
  "homepage": "https://github.com/jasonrig/slop-market",
  "repository": "https://github.com/jasonrig/slop-market/tree/main/plugins/marketplace-starter",
  "license": "MIT"
}
